ID,วันที่,ประเภทการซื้อ,รายการสินค้า/วัตถุดิบ,จำนวนเงิน,ร้านที่ซื้อ,หมายเหตุ,ไฟล์ใบเสร็จ,URL ใบเสร็จ,สถานะใบเสร็จ
EXP001,2025-09-07,วัตถุดิบ,ขนมปัง แฮม ชีส เนย,450,โลตัส,ซื้อของประจำวัน,receipt_001.jpg,,มีใบเสร็จ
EXP002,2025-09-06,เครื่องดื่ม,กาแฟ ชา นม,280,7-Eleven,เติมสต๊อกเครื่องดื่ม,receipt_002.jpg,,มีใบเสร็จ
EXP003,2025-09-05,วัตถุดิบ,แยม น้ำผึ้ง ไข่,320,แม็คโคร,ซื้อของสำรอง,receipt_003.jpg,,มีใบเสร็จ
EXP004,2025-09-04,บรรจุภัณฑ์,ถุงกระดาษ กล่องโฟม,150,ร้านค้าส่ง,บรรจุภัณฑ์,,,ไม่มีใบเสร็จ
EXP005,2025-09-03,วัตถุดิบ,เบคอน ทูน่า ผักกาด,380,เทสโก้,วัตถุดิบสำหรับโทสต์,receipt_005.jpg,,มีใบเสร็จ